{"schema_version":"1.0.0","module":{"id":"10","name":"checked-integer-cast","directory":"projects/10-checked-integer-cast","summary":"Fallible integer conversion that rejects unrepresentable values.","status":"experimental-unverified","category":"numeric-boundary","tags":["integer","cast","range-check","freestanding"]},"purpose":"Convert an integer to another integer type without truncation, wrapping, or sign loss.","c_pain":{"summary":"Implicit narrowing and signedness conversions silently change values.","failure_modes":["truncation","negative-to-unsigned conversion","destination overflow"],"why_c_is_attractive":"C casts are concise and direct.","where_c_degrades":"Representability checks are optional and scattered."},"zig_response":{"summary":"Use one explicit error-returning conversion boundary.","language_features":["error union","comptime type","std.math.cast"],"guarantees_made_visible":["successful result preserves the mathematical value","failure has no side effects"],"remaining_programmer_responsibilities":["perform domain validation after representability"]},"public_surface":{"root_symbols":["checkedIntegerCast"],"types":[],"functions":[{"name":"checkedIntegerCast","signature":"checkedIntegerCast(comptime Destination: type, value: anytype) error{OutOfRange}!Destination"}],"methods":[],"errors":["OutOfRange"],"constants":[]},"locations":{"implementation":["projects/10-checked-integer-cast/src/checked_integer_cast.zig"],"test_source":["projects/10-checked-integer-cast/src/checked_integer_cast.zig"],"readme":"projects/10-checked-integer-cast/README.md","mastery":"projects/10-checked-integer-cast/MASTERY.md","details_markdown":"projects/10-checked-integer-cast/DETAILS.md","details_json":"projects/10-checked-integer-cast/details.json","examples":[],"benchmarks":[],"fixtures":[],"fuzz":[]},"inputs":[{"name":"Destination","type":"type","ownership":"compile-time","lifetime":"program","constraints":"integer type"},{"name":"value","type":"integer or comptime_int","ownership":"copied","lifetime":"call","constraints":"must be representable for success"}],"outputs":[{"name":"converted value","type":"Destination","ownership":"copied","lifetime":"caller-owned scalar","invalidation":"none","caller_cleanup":"none"}],"state":[],"invariants":["every successful result exactly preserves the source mathematical value"],"failure_behavior":{"errors":[{"operation":"checkedIntegerCast","error":"OutOfRange","state_change":"none"}],"optional_empty_results":[],"failure_atomicity":"stateless","partial_effects":[],"panic_conditions":[],"undefined_behavior_preconditions":[]},"ownership":{"owns":[],"borrows":[],"copies":["input and output scalar"],"transfers":[],"allocator":"none","element_cleanup":"none"},"cleanup":[],"invalidation":[],"dependencies":{"repository":[],"standard_library":["std.math.cast","std.testing"],"external":[],"conceptual":["representability"]},"expected_dependents":[{"name":"bounded integer construction","reason":"convert before semantic range validation"},{"name":"binary parser","reason":"convert field widths safely"},{"name":"FFI gate","reason":"validate foreign integer widths"}],"composition":{"import_name":"checked_integer_cast","import_configuration":"Import projects/10-checked-integer-cast/src/checked_integer_cast.zig.","minimal_example":"const cast = @import(\"checked_integer_cast.zig\"); const value = try cast.checkedIntegerCast(u16, raw);","integration_patterns":[],"incompatible_combinations":[],"replacement_options":[]},"compatibility":{"zig_version":"0.14.0","hosted":"yes","freestanding":"yes","thread_safe":"stateless","reentrant":"yes","endianness":"not applicable","platforms":[],"architectures":[],"allocator_assumptions":"none","ffi":"useful at ABI boundaries; no stable ABI","no_std_equivalent":"already freestanding-suitable"},"complexity":{"operations":[{"operation":"checkedIntegerCast","time":"O(1)"}],"space":"O(1)","compile_time":"destination type specialization","notes":[]},"limits":[],"validation":{"build_step":"test-checked-integer-cast","commands":["zig build test-checked-integer-cast","zig build test"],"compiler_validated":false,"compiler_version":"","last_validated_commit":"","unit_tests":["widening","narrowing","signedness","out-of-range","comptime literal"],"integration_tests":[],"property_tests":[],"fuzz_tests":[],"benchmarks":[],"known_failures":[],"notes":["Build registration and local Zig 0.14.0 validation pending."]},"documentation":{"read_order":["README.md","MASTERY.md","DETAILS.md","details.json","src/checked_integer_cast.zig"],"examples_covered":["safe narrowing"],"exercises":[],"glossary_terms":["representability","narrowing","signedness"],"related_modules":["bounded-integer","nonzero-integer"]},"maintenance":{"stability":"experimental","breaking_change_policy":"Update source, tests, all contracts, build, catalog, and dependents together.","known_gaps":["compiler validation pending"],"planned_extensions":[],"review_triggers":["accepted source type changes","error changes"],"synchronization_requirements":["public signature must match source"]},"search":{"capabilities":["checked integer cast","safe narrowing","signedness validation"],"problems":["integer truncation","unsafe cast"],"inputs":["integer"],"outputs":["representable integer"],"environments":["hosted","freestanding"],"keywords":["checked cast","integer conversion","range cast"]}}