{"schema_version":"1.0.0","module":{"id":"02","name":"dynamic-array","directory":"projects/02-dynamic-array","summary":"Allocator-backed growable contiguous sequence.","status":"experimental-unverified","category":"container","tags":["allocator","growth","contiguous","generic","ownership"]},"purpose":"Store a runtime-sized sequence while making allocator ownership, checked growth, cleanup, and reallocation invalidation explicit.","c_pain":{"summary":"C growable arrays concentrate overflow, realloc failure, stale-pointer, and cleanup hazards in deceptively small code.","failure_modes":["capacity arithmetic overflow","losing the original pointer after failed realloc","len updated before allocation succeeds","stale pointers after growth","allocator mismatch","partial cleanup leaks"],"why_c_is_attractive":"A pointer, length, capacity, and realloc loop produce a fast compact container.","where_c_degrades":"Every added requirement multiplies informal ownership, failure ordering, and invalidation rules."},"zig_response":{"summary":"An allocator is stored explicitly; growth uses checked arithmetic and replacement-before-commit semantics.","language_features":["Allocator","error unions","std.math.add","std.math.mul","errdefer","slices","comptime generics"],"guarantees_made_visible":["len <= capacity","failed growth preserves existing state","cleanup uses the same allocator","initialized values are exposed as slices"],"remaining_programmer_responsibilities":["choose allocator and growth suitability","avoid retaining slices across growth","clean element-owned resources before container cleanup"]},"public_surface":{"root_symbols":["DynamicArray"],"types":[{"name":"DynamicArray(T)","kind":"generic type factory"}],"functions":[],"methods":[{"name":"init","signature":"init(allocator: std.mem.Allocator) Self"},{"name":"deinit","signature":"deinit(self: *Self) void"},{"name":"capacity","signature":"capacity(self: *const Self) usize"},{"name":"items","signature":"items(self: *Self) []T"},{"name":"constItems","signature":"constItems(self: *const Self) []const T"},{"name":"append","signature":"append(self: *Self, value: T) !void"},{"name":"pop","signature":"pop(self: *Self) ?T"},{"name":"get","signature":"get(self: *const Self, index: usize) ?T"},{"name":"clearRetainingCapacity","signature":"clearRetainingCapacity(self: *Self) void"},{"name":"ensureUnusedCapacity","signature":"ensureUnusedCapacity(self: *Self, additional: usize) !void"}],"errors":["OutOfMemory","Overflow"],"constants":[]},"locations":{"implementation":["projects/02-dynamic-array/src/dynamic_array.zig"],"test_source":["projects/02-dynamic-array/src/dynamic_array.zig"],"readme":"projects/02-dynamic-array/README.md","mastery":"projects/02-dynamic-array/MASTERY.md","details_markdown":"projects/02-dynamic-array/DETAILS.md","details_json":"projects/02-dynamic-array/details.json","examples":[],"benchmarks":[],"fixtures":[],"fuzz":[]},"inputs":[{"name":"allocator","type":"std.mem.Allocator","ownership":"copied allocator handle","lifetime":"must remain valid through deinit","constraints":"must free allocations it creates"},{"name":"value","type":"T","ownership":"copied into storage","lifetime":"until removed or cleared","constraints":"element cleanup external"},{"name":"additional","type":"usize","ownership":"value","lifetime":"call","constraints":"checked with len for overflow"}],"outputs":[{"name":"items","type":"[]T or []const T","ownership":"borrowed","lifetime":"until growth, deinit, or mutation affecting contents","invalidation":"any reallocation invalidates all prior slices and pointers","caller_cleanup":"none"},{"name":"pop result","type":"?T","ownership":"copied out","lifetime":"caller value","invalidation":"none","caller_cleanup":"depends on T"}],"state":[{"name":"allocator","type":"std.mem.Allocator","role":"allocation and release authority"},{"name":"storage","type":"[]T","role":"allocated capacity"},{"name":"len","type":"usize","role":"initialized prefix length"}],"invariants":["len <= storage.len","storage[0..len] contains initialized values","storage.len is capacity","the stored allocator releases storage"],"failure_behavior":{"errors":[{"operation":"append/ensureUnusedCapacity","error":"OutOfMemory","state_change":"none"},{"operation":"ensureUnusedCapacity","error":"Overflow","state_change":"none"}],"optional_empty_results":[{"operation":"pop","meaning":"empty"},{"operation":"get","meaning":"out of range"}],"failure_atomicity":"Replacement storage is allocated and copied before self.storage is committed.","partial_effects":[],"panic_conditions":[],"undefined_behavior_preconditions":["borrowed views must not outlive or cross reallocation","deinit exactly once"]},"ownership":{"owns":["storage allocation"],"borrows":[],"copies":["appended values","allocator handle"],"transfers":[],"allocator":"caller supplied and retained","element_cleanup":"not performed automatically"},"cleanup":[{"operation":"deinit","releases":"storage allocation","postcondition":"self becomes undefined"}],"invalidation":[{"reference":"items slices and element pointers","trigger":"capacity growth or deinit","effect":"address invalid"},{"reference":"logical element references","trigger":"pop or clear","effect":"element no longer logically present"}],"dependencies":{"repository":[],"standard_library":["std.mem.Allocator","std.math","std.testing"],"external":[],"conceptual":["fixed-capacity vector","failure atomicity"]},"expected_dependents":[{"name":"05-stack","reason":"growable LIFO storage"},{"name":"06-byte-writer","reason":"owned byte accumulation"},{"name":"hash table","reason":"owned bucket storage"},{"name":"token buffer","reason":"runtime token sequence"}],"composition":{"import_name":"dynamic_array","import_configuration":"Import projects/02-dynamic-array/src/dynamic_array.zig or register it as a build module.","minimal_example":"const DynamicArray = @import(\"dynamic_array\").DynamicArray;\nvar values = DynamicArray(u32).init(allocator);\ndefer values.deinit();\ntry values.append(1);","integration_patterns":[{"with":"stack","pattern":"wrap DynamicArray and expose only LIFO operations"},{"with":"byte writer","pattern":"specialize DynamicArray(u8) and add encoding operations"}],"incompatible_combinations":["freestanding environments without a compatible allocator"],"replacement_options":[{"condition":"known compile-time maximum","module":"00-fixed-capacity-vector"}]},"compatibility":{"zig_version":"0.14.0","hosted":"yes","freestanding":"only with a supplied freestanding allocator","thread_safe":"no internal synchronization","reentrant":"yes for distinct instances","endianness":"not applicable","platforms":[],"architectures":[],"allocator_assumptions":"allocator supports alloc and free for T slices","ffi":"not ABI-stable","no_std_equivalent":"supply custom allocator or use fixed vector"},"complexity":{"operations":[{"operation":"append","time":"amortized O(1), worst O(n)"},{"operation":"pop/get","time":"O(1)"},{"operation":"growth","time":"O(n)"},{"operation":"clearRetainingCapacity","time":"O(1) excluding element cleanup"}],"space":"O(capacity)","compile_time":"one concrete type per T","notes":["capacity doubles from an initial capacity of 4"]},"limits":[{"name":"maximum capacity","value":"bounded by usize, allocator, and checked doubling","source":"runtime"}],"validation":{"build_step":"test-dynamic-array","commands":["zig build test-dynamic-array","zig build test"],"compiler_validated":false,"compiler_version":"","last_validated_commit":"","unit_tests":["growth preserves values","pop and clear","empty state"],"integration_tests":[],"property_tests":[],"fuzz_tests":[],"benchmarks":[],"known_failures":[],"notes":["Compiler validation pending."]},"documentation":{"read_order":["README.md","MASTERY.md","DETAILS.md","details.json","src/dynamic_array.zig"],"examples_covered":["append growth","pop","clear retaining capacity"],"exercises":["insert","ordered remove","shrink","element cleanup policy"],"glossary_terms":["allocator","capacity","reallocation","failure atomicity","invalidation"],"related_modules":["00-fixed-capacity-vector","05-stack","06-byte-writer"]},"maintenance":{"stability":"experimental","breaking_change_policy":"Update dependents and all contracts together.","known_gaps":["compiler validation pending","numbering drift exists elsewhere in repository"],"planned_extensions":[],"review_triggers":["growth policy change","allocator semantics change","public field or method change"],"synchronization_requirements":["keep Stack and ByteWriter dependency contracts synchronized"]},"search":{"capabilities":["growable array","owned contiguous storage","generic vector"],"problems":["realloc failure","capacity overflow","stale pointers","allocator ownership"],"inputs":["allocator","generic values"],"outputs":["borrowed slice","optional value"],"environments":["hosted","freestanding with allocator"],"keywords":["dynamic array","vector","array list","growable buffer","allocator-backed"]}}