{"schema_version":"1.0.0","module":{"id":"03","name":"bit-set","directory":"projects/03-bit-set","summary":"Compact fixed-count Boolean state stored in machine words.","status":"experimental-unverified","category":"bit-structure","tags":["bitset","bitmap","flags","freestanding","compact"]},"purpose":"Represent a compile-time number of Boolean states compactly with checked indices and masked padding bits.","c_pain":{"summary":"C bitmap code commonly repeats word and mask arithmetic, permits invalid shifts, and accidentally treats padding bits as real state.","failure_modes":["out-of-range bit index","invalid shift width","padding bits set by set-all","word-count rounding errors","signed mask bugs"],"why_c_is_attractive":"Bitwise operators make compact state extremely cheap.","where_c_degrades":"Every caller must reproduce the same indexing and masking rules correctly."},"zig_response":{"summary":"The module centralizes bit addressing, uses precise integer types, and preserves unused-bit invariants.","language_features":["comptime bit count","u64 storage","u6 shift amount","error unions","precise casts"],"guarantees_made_visible":["only logical bit indices are accepted","padding bits remain clear","zero-bit sets are valid"],"remaining_programmer_responsibilities":["define synchronization for shared use","choose correct logical bit count","interpret bit meanings consistently"]},"public_surface":{"root_symbols":["BitSet"],"types":[{"name":"BitSet(bit_count)","kind":"generic type factory"}],"functions":[],"methods":[{"name":"set","signature":"set(self: *Self, index: usize) Error!void"},{"name":"unset","signature":"unset(self: *Self, index: usize) Error!void"},{"name":"isSet","signature":"isSet(self: *const Self, index: usize) Error!bool"},{"name":"setAll","signature":"setAll(self: *Self) void"},{"name":"clearAll","signature":"clearAll(self: *Self) void"},{"name":"count","signature":"count(self: *const Self) usize"}],"errors":["OutOfBounds"],"constants":[]},"locations":{"implementation":["projects/03-bit-set/src/bit_set.zig"],"test_source":["projects/03-bit-set/src/bit_set.zig"],"readme":"projects/03-bit-set/README.md","mastery":"projects/03-bit-set/MASTERY.md","details_markdown":"projects/03-bit-set/DETAILS.md","details_json":"projects/03-bit-set/details.json","examples":[],"benchmarks":[],"fixtures":[],"fuzz":[]},"inputs":[{"name":"bit_count","type":"usize","ownership":"compile-time","lifetime":"program","constraints":"may be zero"},{"name":"index","type":"usize","ownership":"value","lifetime":"call","constraints":"index < bit_count"}],"outputs":[{"name":"isSet","type":"bool","ownership":"value","lifetime":"call result","invalidation":"none","caller_cleanup":"none"},{"name":"count","type":"usize","ownership":"value","lifetime":"call result","invalidation":"none","caller_cleanup":"none"}],"state":[{"name":"words","type":"array of u64","role":"physical bit storage"}],"invariants":["logical indices are in 0..bit_count","unused high bits in the final word remain zero","word count equals ceil(bit_count / 64)"],"failure_behavior":{"errors":[{"operation":"set/unset/isSet","error":"OutOfBounds","state_change":"none"}],"optional_empty_results":[],"failure_atomicity":"Index validation occurs before mutation.","partial_effects":[],"panic_conditions":[],"undefined_behavior_preconditions":[]},"ownership":{"owns":["inline word storage"],"borrows":[],"copies":[],"transfers":[],"allocator":"none","element_cleanup":"not applicable"},"cleanup":[],"invalidation":[],"dependencies":{"repository":[],"standard_library":["std.testing","std.math or bit operations"],"external":[],"conceptual":["word indexing","bit masks"]},"expected_dependents":[{"name":"bitmap allocator","reason":"track free and used units"},{"name":"page map","reason":"track physical pages"},{"name":"permission set","reason":"compact Boolean capabilities"}],"composition":{"import_name":"bit_set","import_configuration":"Import source or register build module.","minimal_example":"const BitSet = @import(\"bit_set\").BitSet;\nvar bits = BitSet(128){};\ntry bits.set(7);","integration_patterns":[{"with":"allocator","pattern":"scan clear bits and mark allocations"}],"incompatible_combinations":[],"replacement_options":[{"condition":"runtime bit count","module":"future dynamic bit set"}]},"compatibility":{"zig_version":"0.14.0","hosted":"yes","freestanding":"yes","thread_safe":"no internal synchronization","reentrant":"yes for distinct instances","endianness":"logical behavior independent; raw storage serialization requires an explicit format","platforms":[],"architectures":[],"allocator_assumptions":"none","ffi":"raw layout not stable ABI","no_std_equivalent":"already allocation-free"},"complexity":{"operations":[{"operation":"set/unset/isSet","time":"O(1)"},{"operation":"setAll/clearAll/count","time":"O(words)"}],"space":"ceil(bit_count / 64) * 8 bytes","compile_time":"one type per bit_count","notes":[]},"limits":[{"name":"logical bits","value":"bit_count","source":"compile-time"}],"validation":{"build_step":"test-bit-set","commands":["zig build test-bit-set","zig build test"],"compiler_validated":false,"compiler_version":"","last_validated_commit":"","unit_tests":["set and unset","bounds errors","cross-word bits","setAll padding","zero bits"],"integration_tests":[],"property_tests":[],"fuzz_tests":[],"benchmarks":[],"known_failures":[],"notes":["Compiler validation pending."]},"documentation":{"read_order":["README.md","MASTERY.md","DETAILS.md","details.json","src/bit_set.zig"],"examples_covered":["single bits","word boundary","set all"],"exercises":["find first clear","union/intersection","dynamic storage"],"glossary_terms":["word","mask","padding bit","popcount"],"related_modules":["00-fixed-capacity-vector"]},"maintenance":{"stability":"experimental","breaking_change_policy":"Update all contracts and dependents together.","known_gaps":["compiler validation pending","numeric prefix collides with ring-buffer"],"planned_extensions":["bitmap allocator"],"review_triggers":["storage word type changes","raw serialization added","numbering repair"],"synchronization_requirements":["keep padding invariant documented and tested"]},"search":{"capabilities":["bit set","bitmap","compact flags"],"problems":["invalid shifts","padding bits","repeated mask arithmetic"],"inputs":["bit index"],"outputs":["Boolean state","set-bit count"],"environments":["hosted","freestanding","embedded","hypervisor"],"keywords":["bitset","bitmap","flags","page bitmap","permission bits"]}}