{"schema_version":"1.0.0","module":{"id":"03","name":"ring-buffer","directory":"projects/03-ring-buffer","summary":"Fixed-capacity FIFO with wrapped logical ordering.","status":"experimental-unverified","category":"queue","tags":["fifo","circular-buffer","fixed-capacity","freestanding","queue"]},"purpose":"Provide allocation-free FIFO storage while separating logical order from wrapped physical layout.","c_pain":{"summary":"C circular buffers often encode full and empty ambiguously and scatter modulo arithmetic across callers.","failure_modes":["head equals tail ambiguity","off-by-one wrap errors","overwriting unread values","reading uninitialized slots","zero-capacity modulo","shutdown code assuming linear layout"],"why_c_is_attractive":"Two indices and a fixed array produce a very fast queue.","where_c_degrades":"The state model becomes fragile when full, empty, wrap, and capacity edge cases are represented only by conventions."},"zig_response":{"summary":"The type stores head plus len, derives the tail, and exposes full insertion as an error.","language_features":["comptime capacity","arrays","error unions","optionals"],"guarantees_made_visible":["len <= capacity","logical FIFO order is independent of physical wrap","failed push leaves state unchanged","zero-capacity instance is valid"],"remaining_programmer_responsibilities":["provide synchronization when shared","choose capacity","clean resource-owning elements"]},"public_surface":{"root_symbols":["RingBuffer"],"types":[{"name":"RingBuffer(T, capacity)","kind":"generic type factory"}],"functions":[],"methods":[{"name":"count","signature":"count(self: *const Self) usize"},{"name":"isEmpty","signature":"isEmpty(self: *const Self) bool"},{"name":"isFull","signature":"isFull(self: *const Self) bool"},{"name":"push","signature":"push(self: *Self, value: T) Error!void"},{"name":"pop","signature":"pop(self: *Self) ?T"},{"name":"peek","signature":"peek(self: *const Self) ?T"},{"name":"get","signature":"get(self: *const Self, logical_index: usize) ?T"},{"name":"clear","signature":"clear(self: *Self) void"}],"errors":["Full"],"constants":[]},"locations":{"implementation":["projects/03-ring-buffer/src/ring_buffer.zig"],"test_source":["projects/03-ring-buffer/src/ring_buffer.zig"],"readme":"projects/03-ring-buffer/README.md","mastery":"projects/03-ring-buffer/MASTERY.md","details_markdown":"projects/03-ring-buffer/DETAILS.md","details_json":"projects/03-ring-buffer/details.json","examples":[],"benchmarks":[],"fixtures":[],"fuzz":[]},"inputs":[{"name":"T","type":"type","ownership":"compile-time","lifetime":"program","constraints":"valid Zig type"},{"name":"capacity","type":"usize","ownership":"compile-time","lifetime":"program","constraints":"may be zero"},{"name":"value","type":"T","ownership":"copied","lifetime":"until popped or cleared","constraints":"element cleanup external"}],"outputs":[{"name":"pop/peek/get","type":"?T","ownership":"copied value","lifetime":"caller value","invalidation":"none for copied value","caller_cleanup":"depends on T"}],"state":[{"name":"storage","type":"[capacity]T","role":"physical slots"},{"name":"head","type":"usize","role":"physical index of logical first item"},{"name":"len","type":"usize","role":"logical item count"}],"invariants":["len <= capacity","empty iff len == 0","full iff len == capacity","when len > 0 and capacity > 0 head < capacity","logical index i maps to (head + i) % capacity"],"failure_behavior":{"errors":[{"operation":"push","error":"Full","state_change":"none"}],"optional_empty_results":[{"operation":"pop/peek","meaning":"empty"},{"operation":"get","meaning":"logical index out of range"}],"failure_atomicity":"push checks fullness and zero capacity before writing.","partial_effects":[],"panic_conditions":[],"undefined_behavior_preconditions":[]},"ownership":{"owns":["inline storage"],"borrows":[],"copies":["queued values"],"transfers":[],"allocator":"none","element_cleanup":"caller must drain or clean resource-owning values before clear or destruction"},"cleanup":[],"invalidation":[{"reference":"logical positions","trigger":"push or pop","effect":"indices may refer to different values"}],"dependencies":{"repository":[],"standard_library":["std.testing"],"external":[],"conceptual":["fixed-capacity storage","logical-versus-physical indexing"]},"expected_dependents":[{"name":"work queue","reason":"bounded FIFO jobs"},{"name":"serial buffer","reason":"ordered bytes or events"},{"name":"network receive queue","reason":"bounded frames"}],"composition":{"import_name":"ring_buffer","import_configuration":"Import the source directly or register it as a build module.","minimal_example":"const RingBuffer = @import(\"ring_buffer\").RingBuffer;\nvar q = RingBuffer(u8, 16){};\ntry q.push(1);","integration_patterns":[{"with":"mutex/condition variable","pattern":"wrap operations to create a thread-safe bounded queue"}],"incompatible_combinations":["unbounded queue requirements without an overflow policy"],"replacement_options":[{"condition":"runtime capacity or growth required","module":"02-dynamic-array plus head index"}]},"compatibility":{"zig_version":"0.14.0","hosted":"yes","freestanding":"yes","thread_safe":"no internal synchronization","reentrant":"yes for distinct instances","endianness":"not applicable","platforms":[],"architectures":[],"allocator_assumptions":"none","ffi":"not ABI-stable","no_std_equivalent":"already allocation-free"},"complexity":{"operations":[{"operation":"push/pop/peek/get","time":"O(1)"},{"operation":"clear","time":"O(1) excluding element cleanup"}],"space":"O(capacity) inline","compile_time":"one concrete type per T and capacity","notes":[]},"limits":[{"name":"maximum queued items","value":"capacity","source":"compile-time"}],"validation":{"build_step":"test-ring-buffer","commands":["zig build test-ring-buffer","zig build test"],"compiler_validated":false,"compiler_version":"","last_validated_commit":"","unit_tests":["FIFO order","wrapped order","full failure atomicity","zero capacity"],"integration_tests":[],"property_tests":[],"fuzz_tests":[],"benchmarks":[],"known_failures":[],"notes":["Compiler validation pending."]},"documentation":{"read_order":["README.md","MASTERY.md","DETAILS.md","details.json","src/ring_buffer.zig"],"examples_covered":["push/pop","wrap","full and empty"],"exercises":["iterator","overwrite policy","thread-safe adapter"],"glossary_terms":["FIFO","head","tail","wrap","logical index"],"related_modules":["00-fixed-capacity-vector","02-dynamic-array"]},"maintenance":{"stability":"experimental","breaking_change_policy":"Update contracts, catalog, build, and dependents together.","known_gaps":["compiler validation pending","numeric prefix collides with bit-set module"],"planned_extensions":[],"review_triggers":["state representation change","overflow policy change","numbering repair"],"synchronization_requirements":["keep MODULES.md paths synchronized"]},"search":{"capabilities":["FIFO queue","circular buffer","bounded event queue"],"problems":["head-tail ambiguity","wraparound bugs","queue overflow"],"inputs":["generic values"],"outputs":["optional dequeued value"],"environments":["hosted","freestanding","embedded","hypervisor"],"keywords":["ring buffer","circular queue","FIFO","bounded queue"]}}